{
  "name": "nullapt/web-search",
  "version": "0.1.0",
  "description": "Search the web via DuckDuckGo's Instant Answer API. Returns abstract plus related-topic links.",
  "author": "nullapt",
  "homepage": "https://github.com/nullapt/examples/tree/main/web-search-skill",
  "license": "MIT",
  "registry_url": "https://registry.nullapt.dev/v1/skills/nullapt/web-search",
  "tags": ["search", "web", "productivity", "duckduckgo"],
  "permissions_summary": {
    "network": true,
    "network_domains": ["api.duckduckgo.com"],
    "filesystem": false,
    "env": []
  }
}
