{
  "name": "hello-skill",
  "version": "0.1.0",
  "description": "Minimal sandboxed greeting skill — best starting point for skill authors",
  "author": "nullapt",
  "homepage": "https://github.com/nullapt/examples/tree/main/rust-hello-skill",
  "license": "MIT",
  "registry_url": "https://registry.nullapt.dev/v1/skills/hello-skill",
  "tags": ["example", "starter"],
  "permissions_summary": {
    "network": false,
    "filesystem": false,
    "env": []
  }
}
